{"$schema":"https://json-schema.org/draft/2020-12/schema","type":"object","required":["vector_id","source_nodes","reasoning_dependencies","continuity_constraints","authority_constraints","replay_requirements","divergence_classes","canonical_outputs"],"properties":{"vector_id":{"type":"string"},"source_nodes":{"type":"array","items":{"type":"string"}},"reasoning_dependencies":{"type":"array","items":{"type":"string"}},"continuity_constraints":{"type":"array","items":{"type":"string"}},"authority_constraints":{"type":"array","items":{"type":"string"}},"replay_requirements":{"type":"array","items":{"type":"string"}},"divergence_classes":{"type":"array","items":{"type":"string"}},"canonical_outputs":{"type":"array","items":{"type":"string"}}}}
